{
  "$schema": "../../../src/data/docs-authoring-schema.json",
  "id": "examples-render-targets",
  "title": "render targets examples",
  "group": "Repository examples",
  "sections": [
    {
      "id": "about-these-examples",
      "blocks": [
        {
          "type": "heading",
          "level": 2,
          "text": "Repository examples"
        },
        {
          "type": "paragraph",
          "text": "These repository examples run in the embedded playground with editable TypeScript, a live preview, an authored walkthrough, suggested experiments, detected requirements and related APIs. Entries that support other scenes instead of exporting a Scene are shown as source modules without a play control."
        },
        {
          "type": "paragraph",
          "text": "For a smaller scene with one learning goal, start with [Focused scene examples](/focused-examples)."
        }
      ]
    },
    {
      "id": "blur-animation-demo",
      "blocks": [
        {
          "type": "heading",
          "level": 2,
          "text": "blur animation demo"
        },
        {
          "type": "example",
          "example": "render_targets/blur_animation_demo"
        }
      ]
    },
    {
      "id": "blur-demo",
      "blocks": [
        {
          "type": "heading",
          "level": 2,
          "text": "blur demo"
        },
        {
          "type": "example",
          "example": "render_targets/blur_demo"
        }
      ]
    },
    {
      "id": "feedback-demo",
      "blocks": [
        {
          "type": "heading",
          "level": 2,
          "text": "feedback demo"
        },
        {
          "type": "example",
          "example": "render_targets/feedback_demo"
        }
      ]
    },
    {
      "id": "gbuffer-demo",
      "blocks": [
        {
          "type": "heading",
          "level": 2,
          "text": "gbuffer demo"
        },
        {
          "type": "example",
          "example": "render_targets/gbuffer_demo"
        }
      ]
    },
    {
      "id": "offscreen-demo",
      "blocks": [
        {
          "type": "heading",
          "level": 2,
          "text": "offscreen demo"
        },
        {
          "type": "example",
          "example": "render_targets/offscreen_demo"
        }
      ]
    },
    {
      "id": "persistent-demo",
      "blocks": [
        {
          "type": "heading",
          "level": 2,
          "text": "persistent demo"
        },
        {
          "type": "example",
          "example": "render_targets/persistent_demo"
        }
      ]
    },
    {
      "id": "pingpong-demo",
      "blocks": [
        {
          "type": "heading",
          "level": 2,
          "text": "pingpong demo"
        },
        {
          "type": "example",
          "example": "render_targets/pingpong_demo"
        }
      ]
    },
    {
      "id": "storage-demo",
      "blocks": [
        {
          "type": "heading",
          "level": 2,
          "text": "storage demo"
        },
        {
          "type": "example",
          "example": "render_targets/storage_demo"
        }
      ]
    }
  ],
  "summary": "Run and study repository examples with editable source, live previews, authored explanations and related API guidance."
}
