{
  "$schema": "../../../src/data/docs-authoring-schema.json",
  "id": "examples-hybrid-pipelines",
  "title": "hybrid pipelines examples",
  "group": "Repository examples",
  "sections": [
    {
      "id": "about-these-examples",
      "blocks": [
        {
          "type": "heading",
          "level": 2,
          "text": "Repository examples"
        },
        {
          "type": "tabs",
          "tabs": [
            {
              "label": "Text Vector",
              "blocks": [
                {
                  "type": "example",
                  "example": "labs/pg-text-vector"
                }
              ]
            },
            {
              "label": "Image Replace",
              "blocks": [
                {
                  "type": "example",
                  "example": "labs/pg-image-replace"
                }
              ]
            },
            {
              "label": "Primitive Box",
              "blocks": [
                {
                  "type": "example",
                  "example": "labs/pg-primitive-box"
                }
              ]
            }
          ]
        },
        {
          "type": "paragraph",
          "text": "These repository examples run in the embedded playground with editable TypeScript, a live preview, an authored walkthrough, suggested experiments, detected requirements and related APIs. Entries that support other scenes instead of exporting a Scene are shown as source modules without a play control."
        },
        {
          "type": "paragraph",
          "text": "For a smaller scene with one learning goal, start with [Focused scene examples](/focused-examples)."
        }
      ]
    },
    {
      "id": "hybrid-mix",
      "blocks": [
        {
          "type": "heading",
          "level": 2,
          "text": "hybrid mix"
        },
        {
          "type": "example",
          "example": "hybrid_pipelines/hybrid_mix"
        }
      ]
    }
  ],
  "summary": "Run and study repository examples with editable source, live previews, authored explanations and related API guidance."
}
