{
  "$schema": "../../../src/data/docs-authoring-schema.json",
  "id": "examples-tts",
  "title": "tts examples",
  "group": "Repository examples",
  "sections": [
    {
      "id": "about-these-examples",
      "blocks": [
        {
          "type": "heading",
          "level": 2,
          "text": "Repository examples"
        },
        {
          "type": "paragraph",
          "text": "These repository examples run in the embedded playground with editable TypeScript, a live preview, an authored walkthrough, suggested experiments, detected requirements and related APIs. Entries that support other scenes instead of exporting a Scene are shown as source modules without a play control."
        },
        {
          "type": "paragraph",
          "text": "For a smaller scene with one learning goal, start with [Focused scene examples](/focused-examples)."
        }
      ]
    },
    {
      "id": "msedge-tts-demo",
      "blocks": [
        {
          "type": "heading",
          "level": 2,
          "text": "msedge tts demo"
        },
        {
          "type": "example",
          "example": "tts/msedge_tts_demo"
        }
      ]
    }
  ],
  "summary": "Run and study repository examples with editable source, live previews, authored explanations and related API guidance."
}
