{
  "$schema": "../../../src/data/docs-authoring-schema.json",
  "id": "examples-camera-anim",
  "title": "camera anim examples",
  "group": "Repository examples",
  "sections": [
    {
      "id": "about-these-examples",
      "blocks": [
        {
          "type": "heading",
          "level": 2,
          "text": "Repository examples"
        },
        {
          "type": "tabs",
          "tabs": [
            {
              "label": "Camera Move",
              "blocks": [
                {
                  "type": "example",
                  "example": "labs/pg-camera-move"
                }
              ]
            },
            {
              "label": "Camera Look",
              "blocks": [
                {
                  "type": "example",
                  "example": "labs/pg-camera-look"
                }
              ]
            },
            {
              "label": "Camera Orbit",
              "blocks": [
                {
                  "type": "example",
                  "example": "labs/pg-camera-orbit"
                }
              ]
            },
            {
              "label": "Camera Dolly",
              "blocks": [
                {
                  "type": "example",
                  "example": "labs/pg-camera-dolly"
                }
              ]
            },
            {
              "label": "Fixed Hud",
              "blocks": [
                {
                  "type": "example",
                  "example": "labs/pg-fixed-hud"
                }
              ]
            }
          ]
        },
        {
          "type": "paragraph",
          "text": "These repository examples run in the embedded playground with editable TypeScript, a live preview, an authored walkthrough, suggested experiments, detected requirements and related APIs. Entries that support other scenes instead of exporting a Scene are shown as source modules without a play control."
        },
        {
          "type": "paragraph",
          "text": "For a smaller scene with one learning goal, start with [Focused scene examples](/focused-examples)."
        }
      ]
    },
    {
      "id": "camera-anim",
      "blocks": [
        {
          "type": "heading",
          "level": 2,
          "text": "camera anim"
        },
        {
          "type": "example",
          "example": "camera_anim/camera_anim"
        }
      ]
    },
    {
      "id": "fix-to-camera",
      "blocks": [
        {
          "type": "heading",
          "level": 2,
          "text": "fix to camera"
        },
        {
          "type": "example",
          "example": "camera_anim/fix_to_camera"
        }
      ]
    }
  ],
  "summary": "Run and study repository examples with editable source, live previews, authored explanations and related API guidance."
}
