{
  "$schema": "../../../src/data/docs-authoring-schema.json",
  "id": "examples-media-textures",
  "title": "media textures examples",
  "group": "Repository examples",
  "sections": [
    {
      "id": "about-these-examples",
      "blocks": [
        {
          "type": "heading",
          "level": 2,
          "text": "Repository examples"
        },
        {
          "type": "paragraph",
          "text": "These repository examples run in the embedded playground with editable TypeScript, a live preview, an authored walkthrough, suggested experiments, detected requirements and related APIs. Entries that support other scenes instead of exporting a Scene are shown as source modules without a play control."
        },
        {
          "type": "paragraph",
          "text": "For a smaller scene with one learning goal, start with [Focused scene examples](/focused-examples)."
        }
      ]
    },
    {
      "id": "html-in-canvas",
      "blocks": [
        {
          "type": "heading",
          "level": 2,
          "text": "html in canvas"
        },
        {
          "type": "example",
          "example": "media_textures/html_in_canvas"
        }
      ]
    },
    {
      "id": "media-raster",
      "blocks": [
        {
          "type": "heading",
          "level": 2,
          "text": "media raster"
        },
        {
          "type": "example",
          "example": "media_textures/media_raster"
        }
      ]
    },
    {
      "id": "texture-atlas",
      "blocks": [
        {
          "type": "heading",
          "level": 2,
          "text": "texture atlas"
        },
        {
          "type": "example",
          "example": "media_textures/texture_atlas"
        }
      ]
    },
    {
      "id": "texture-mapping",
      "blocks": [
        {
          "type": "heading",
          "level": 2,
          "text": "texture mapping"
        },
        {
          "type": "example",
          "example": "media_textures/texture_mapping"
        }
      ]
    }
  ],
  "summary": "Run and study repository examples with editable source, live previews, authored explanations and related API guidance."
}
